row_id;question;pole_1;pole_2;model_dimension;rule_applied;notes
r3_70;If a new device makes your job easier but potentially eliminates jobs for others, would you use it?;No, I would not support anything that could harm job security for others.;Yes, personal productivity and efficiency is of utmost importance.;Unmapped;G1;Attitude to technology + individual gain vs collective welfare.
r3_71;What are your thoughts on informal meetings or team huddles during work hours?;Informal meetings can be refreshing and beneficial as they allow room for open communication and camaraderie.;Work hours should be strictly dedicated to formal work activities. Informal meetings can be a distraction.;Trusting;direct;Informal camaraderie vs formal task-only work. 'Distraction' wording flirts with Scheduling but the axis is task vs relationship.
r3_72;How do you perceive competitiveness in the workplace?;It can induce unnecessary stress and disturb the peace and cooperative atmosphere in the workplace.;It's a fundamental aspect of professional growth and a motivation to achieve higher ranks.;Unmapped;G1;Competitiveness vs cooperativeness.
r3_73;If there's an issue with implementing a new technology, do you think it's right for the upper management to handle the problem without involving the lower level employees?;No, every team member should be involved in solving technological problems as they also have valuable insights.;Yes, as they have a broader understanding of the business implications and complexities.;Deciding;G6;Top-down vs inclusive problem-solving
r3_74;How do you usually handle work assignments or projects?;I plan ahead, breaking down tasks and managing them over time to reduce stress and ensure high-quality results.;I prefer to work on tasks all at once, or closer to the deadline, focusing on meeting immediate targets.;Scheduling;direct;Genuine Scheduling: sequential planning over time vs many-at-once / last-minute. Linear vs flexible time.
r3_75;How do you perceive the initiative to implement automation technology in workplaces?;Worrisome! It can disrupt the traditional human-centered work model and could potentially lead to job displacement.;Encouraging! It allows us to spend less time on repetitive tasks, increasing productivity and leisure time.;Unmapped;G1;Attitude to technology / change.
r3_76;How do you envision your interactions with coworkers socially?;Maintaining a formal, business-only relationship to ensure complete focus on work.;Encouraging frequent socializing with coworkers for holistic personal and professional growth.;Trusting;direct;Business-only vs social relations with coworkers = task- vs relationship-based.
r3_77;Who do you think should decide whether a new technology is useful or not for the organization?;Only high-ranking decision-makers, as they have the overview and expertise to judge.;All members of the organization, since practical usefulness can best be evaluated by those directly affected.;Deciding;G6;High-ranking decision-makers vs all members
r3_78;How would you react if offered a promotion that would require more time away from home?;I would consider the implications to my family life first, as I believe in the importance of maintaining work-family balance.;I would accept it, as professional promotions contribute to my individual success.;Unmapped;G1;Work-life balance.
r3_79;When faced with an issue in a team project, do you prefer to come up with solutions that address the immediate problems or those that might prevent similar issues in the future?;I prefer to focus on solutions that solve the immediate issues at hand.;I would rather explore solutions that address the root of the problem to mitigate similar situations from happening in the future.;Unmapped;G1;Immediate fix vs root-cause prevention = short- vs long-term orientation. G2.
r3_80;If you had to choose, would you sacrifice your current job satisfaction for future growth?;Yes, if it contributes to my long-term career development and potential future satisfaction.;No, my current happiness and satisfaction in my role are most important to me.;Unmapped;G1;Long-term orientation. G2.
r3_81;What is your outlook regarding the responsibility and tasks distribution among the team members?;Distribution of tasks should be decided collectively after a discussion among all the team members.;Tasks should be assigned by the team leader based on their understanding of everyone's skills and capabilities.;Deciding;G6;Collective discussion vs leader assigns
r3_82;When launching a technological innovation, how should the company communicate changes to its employees?;The company should encourage an open discussion so that everyone understands the reasons behind the changes.;The high-level management should make final decisions and inform the employees about the changes.;Deciding;G6;Open discussion vs management decides and informs
r3_83;How should conflicts be handled within a team focusing on technological innovation?;Conflicts should be addressed by building consensus, appeasing all parties involved and seeking harmonious collective decision-making.;Conflicts should be viewed as a normal part of the innovative process, with the strongest idea prevailing.;Disagreeing;direct;Conflict as harmony threat vs conflict as normal. 'Collective decision-making' wording touches Deciding but conflict tolerance is the axis.
r3_84;How do you feel about the idea of changing jobs or shifting careers frequently?;I view changing jobs or shifting careers frequently as an opportunity for self-development and higher achievements.;I believe sticking with the same job or career aids in maintaining harmony and tradition in the workplace.;Unmapped;G1;Attitude to change + job security. G2 names job security explicitly.
r3_85;What characteristic makes a leader more effective in a work environment?;Quick decision-making abilities that provide immediate solutions to problems.;Long-term strategic thinking that focuses on the future sustainability of the team and organization.;Unmapped;G1;Short-term vs long-term orientation. G2.
r3_86;What's emphasized more in your workplace's leadership style?;The leadership emphasizes on consensus, shared responsibilities, and team harmony.;The leadership stresses on decisiveness, individual responsibility, and achievement-oriented objectives.;Unmapped;G1;Consensus pole tempts Deciding, but the contrast pole is individual responsibility/achievement, not top-down authority. Confounded.
r3_87;In a professional healthcare setting, what should be the primary focus?;On fostering an environment of caring and intimacy, focusing on patient relationships and their lived experiences.;On achieving the best results and advancements in health technologies to combat diseases independently.;Unmapped;G1;Humane orientation vs performance orientation.
r3_88;How would you approach a project with a distant deadline at work?;I would plan ahead, organize tasks strategically, focusing on perfecting the end product even if it requires more time and effort.;I would prioritize tasks based on their urgency and address them one by one, prioritizing immediate progress over long-term perfection.;Unmapped;G1;G2, hardest call: BOTH poles are monochronic ('one by one', 'plan ahead'). The real contrast is long-term perfection vs immediate progress, so no Scheduling axis.
r3_89;How would you describe your acceptance of authority in your job and deference to your manager's decisions?;In my job, the authority should not be concentrated in one hand, and decisions should be open for discussion and input.;In my job, it is accepted that the manager has full authority and we should comply with their decisions.;Leading;G6;Acceptance of authority/deference dominant
r3_90;What's your stand on investing in education or skills training for your future career?;I prefer focusing more on gaining practical experience in my current role than spending time on learning new skills or education.;I believe that continuous learning and skill enhancement are significant for my long-term career growth.;Unmapped;G1;Long-term orientation. G2.
